DATE,Date,CPIAUCSL_PC1
01/01/1948,1948-01-01,10.24209
01/02/1948,1948-02-01,9.48196
01/03/1948,1948-03-01,6.81818
01/04/1948,1948-04-01,8.27273
01/05/1948,1948-05-01,9.38497
01/06/1948,1948-06-01,9.375
01/07/1948,1948-07-01,9.76158
01/08/1948,1948-08-01,9.0625
01/09/1948,1948-09-01,6.65499
01/10/1948,1948-10-01,6.11087
01/11/1948,1948-11-01,4.77016
01/12/1948,1948-12-01,2.73387
01/01/1949,1949-01-01,1.39358
01/02/1949,1949-02-01,1.01394
01/03/1949,1949-03-01,1.74468
01/04/1949,1949-04-01,0.41982
01/05/1949,1949-05-01,-0.41649
01/06/1949,1949-06-01,-0.95238
01/07/1949,1949-07-01,-2.86885
01/08/1949,1949-08-01,-2.98813
01/09/1949,1949-09-01,-2.50411
01/10/1949,1949-10-01,-2.63266
01/11/1949,1949-11-01,-1.90397
01/12/1949,1949-12-01,-1.82952
01/01/1950,1950-01-01,-2.08247
01/02/1950,1950-02-01,-1.25471
01/03/1950,1950-03-01,-1.12923
01/04/1950,1950-04-01,-1.12876
01/05/1950,1950-05-01,-0.58553
01/06/1950,1950-06-01,-0.16722
01/07/1950,1950-07-01,1.56118
01/08/1950,1950-08-01,2.1097
01/09/1950,1950-09-01,2.48421
01/10/1950,1950-10-01,3.50655
01/11/1950,1950-11-01,3.79747
01/12/1950,1950-12-01,5.80263
01/01/1951,1951-01-01,7.95406
01/02/1951,1951-02-01,9.4028
01/03/1951,1951-03-01,9.47547
01/04/1951,1951-04-01,9.59831
01/05/1951,1951-05-01,9.3395
01/06/1951,1951-06-01,8.58459
01/07/1951,1951-07-01,7.64437
01/08/1951,1951-08-01,6.8595
01/09/1951,1951-09-01,6.9433
01/10/1951,1951-10-01,6.77551
01/11/1951,1951-11-01,6.99187
01/12/1951,1951-12-01,5.96477
01/01/1952,1952-01-01,4.21592
01/02/1952,1952-02-01,2.24545
01/03/1952,1952-03-01,1.97063
01/04/1952,1952-04-01,2.08333
01/05/1952,1952-05-01,1.84686
01/06/1952,1952-06-01,2.31392
01/07/1952,1952-07-01,2.97183
01/08/1952,1952-08-01,3.20959
01/09/1952,1952-09-01,2.30503
01/10/1952,1952-10-01,2.02599
01/11/1952,1952-11-01,1.40578
01/12/1952,1952-12-01,0.90669
01/01/1953,1953-01-01,0.71834
01/02/1953,1953-02-01,0.68156
01/03/1953,1953-03-01,0.90944
01/04/1953,1953-04-01,0.86924
01/05/1953,1953-05-01,0.86891
01/06/1953,1953-06-01,0.90464
01/07/1953,1953-07-01,0.41229
01/08/1953,1953-08-01,0.59948
01/09/1953,1953-09-01,0.97634
01/10/1953,1953-10-01,0.97415
01/11/1953,1953-11-01,0.59948
01/12/1953,1953-12-01,0.59903
01/01/1954,1954-01-01,1.12613
01/02/1954,1954-02-01,1.50432
01/03/1954,1954-03-01,1.12655
01/04/1954,1954-04-01,0.63694
01/05/1954,1954-05-01,0.86142
01/06/1954,1954-06-01,0.63504
01/07/1954,1954-07-01,0.26129
01/08/1954,1954-08-01,0.0
01/09/1954,1954-09-01,-0.29751
01/10/1954,1954-10-01,-0.85343
01/11/1954,1954-11-01,-0.26071
01/12/1954,1954-12-01,-0.37216
01/01/1955,1955-01-01,-0.63103
01/02/1955,1955-02-01,-0.62986
01/03/1955,1955-03-01,-0.51987
01/04/1955,1955-04-01,-0.26061
01/05/1955,1955-05-01,-0.59413
01/06/1955,1955-06-01,-0.85375
01/07/1955,1955-07-01,-0.3723
01/08/1955,1955-08-01,-0.48417
01/09/1955,1955-09-01,0.1492
01/10/1955,1955-10-01,0.37425
01/11/1955,1955-11-01,0.37341
01/12/1955,1955-12-01,0.37355
01/01/1956,1956-01-01,0.22413
01/02/1956,1956-02-01,0.14914
01/03/1956,1956-03-01,0.37327
01/04/1956,1956-04-01,0.52258
01/05/1956,1956-05-01,0.97124
01/06/1956,1956-06-01,1.64732
01/07/1956,1956-07-01,1.98057
01/08/1956,1956-08-01,2.20808
01/09/1956,1956-09-01,1.8622
01/10/1956,1956-10-01,2.57271
01/11/1956,1956-11-01,2.34375
01/12/1956,1956-12-01,2.82843
01/01/1957,1957-01-01,3.13082
01/02/1957,1957-02-01,3.49963
01/03/1957,1957-03-01,3.60729
01/04/1957,1957-04-01,3.71333
01/05/1957,1957-05-01,3.58861
01/06/1957,1957-06-01,3.53591
01/07/1957,1957-07-01,3.29791
01/08/1957,1957-08-01,3.55181
01/09/1957,1957-09-01,3.54662
01/10/1957,1957-10-01,2.94438
01/11/1957,1957-11-01,3.27154
01/12/1957,1957-12-01,3.04017
01/01/1958,1958-01-01,3.5056
01/02/1958,1958-02-01,3.23741
01/03/1958,1958-03-01,3.62527
01/04/1958,1958-04-01,3.61618
01/05/1958,1958-05-01,3.35714
01/06/1958,1958-06-01,2.84596
01/07/1958,1958-07-01,2.48315
01/08/1958,1958-08-01,2.3338
01/09/1958,1958-09-01,2.08333
01/10/1958,1958-10-01,2.08333
01/11/1958,1958-11-01,1.90074
01/12/1958,1958-12-01,1.75623
01/01/1959,1959-01-01,1.2919
01/02/1959,1959-02-01,1.0453
01/03/1959,1959-03-01,0.34638
01/04/1959,1959-04-01,0.13822
01/05/1959,1959-05-01,0.34554
01/06/1959,1959-06-01,0.6918
01/07/1959,1959-07-01,0.89997
01/08/1959,1959-08-01,0.8293
01/09/1959,1959-09-01,1.17606
01/10/1959,1959-10-01,1.52196
01/11/1959,1959-11-01,1.38169
01/12/1959,1959-12-01,1.51881
01/01/1960,1960-01-01,1.24095
01/02/1960,1960-02-01,1.41379
01/03/1960,1960-03-01,1.51881
01/04/1960,1960-04-01,1.93237
01/05/1960,1960-05-01,1.82507
01/06/1960,1960-06-01,1.71762
01/07/1960,1960-07-01,1.37221
01/08/1960,1960-08-01,1.47361
01/09/1960,1960-09-01,1.23077
01/10/1960,1960-10-01,1.36286
01/11/1960,1960-11-01,1.46508
01/12/1960,1960-12-01,1.36008
01/01/1961,1961-01-01,1.60027
01/02/1961,1961-02-01,1.46209
01/03/1961,1961-03-01,1.46209
01/04/1961,1961-04-01,0.91401
01/05/1961,1961-05-01,0.91309
01/06/1961,1961-06-01,0.77676
01/07/1961,1961-07-01,1.25212
01/08/1961,1961-08-01,1.11449
01/09/1961,1961-09-01,1.24958
01/10/1961,1961-10-01,0.77311
01/11/1961,1961-11-01,0.67159
01/12/1961,1961-12-01,0.67092
01/01/1962,1962-01-01,0.67024
01/02/1962,1962-02-01,0.90483
01/03/1962,1962-03-01,1.1059
01/04/1962,1962-04-01,1.34183
01/05/1962,1962-05-01,1.34048
01/06/1962,1962-06-01,1.23995
01/07/1962,1962-07-01,1.00267
01/08/1962,1962-08-01,1.1356
01/09/1962,1962-09-01,1.46765
01/10/1962,1962-10-01,1.33422
01/11/1962,1962-11-01,1.33422
01/12/1962,1962-12-01,1.23292
01/01/1963,1963-01-01,1.33156
01/02/1963,1963-02-01,1.22883
01/03/1963,1963-03-01,1.12695
01/04/1963,1963-04-01,0.89374
01/05/1963,1963-05-01,0.89286
01/06/1963,1963-06-01,1.32406
01/07/1963,1963-07-01,1.55526
01/08/1963,1963-08-01,1.55218
01/09/1963,1963-09-01,0.98619
01/10/1963,1963-10-01,1.21791
01/11/1963,1963-11-01,1.31666
01/12/1963,1963-12-01,1.64582
01/01/1964,1964-01-01,1.64258
01/02/1964,1964-02-01,1.41076
01/03/1964,1964-03-01,1.40937
01/04/1964,1964-04-01,1.54199
01/05/1964,1964-05-01,1.54048
01/06/1964,1964-06-01,1.30676
01/07/1964,1964-07-01,1.07527
01/08/1964,1964-08-01,0.97561
01/09/1964,1964-09-01,1.17188
01/10/1964,1964-10-01,1.20325
01/11/1964,1964-11-01,1.39701
01/12/1964,1964-12-01,1.19819
01/01/1965,1965-01-01,1.0989
01/02/1965,1965-02-01,1.19702
01/03/1965,1965-03-01,1.19586
01/04/1965,1965-04-01,1.38934
01/05/1965,1965-05-01,1.61394
01/06/1965,1965-06-01,1.93486
01/07/1965,1965-07-01,1.80529
01/08/1965,1965-08-01,1.61031
01/09/1965,1965-09-01,1.73745
01/10/1965,1965-10-01,1.70308
01/11/1965,1965-11-01,1.73021
01/12/1965,1965-12-01,1.92
01/01/1966,1966-01-01,1.91816
01/02/1966,1966-02-01,2.55754
01/03/1966,1966-03-01,2.77866
01/04/1966,1966-04-01,2.86807
01/05/1966,1966-05-01,2.76366
01/06/1966,1966-06-01,2.43594
01/07/1966,1966-07-01,2.75491
01/08/1966,1966-08-01,3.48653
01/09/1966,1966-09-01,3.57369
01/10/1966,1966-10-01,3.79147
01/11/1966,1966-11-01,3.55906
01/12/1966,1966-12-01,3.3595
01/01/1967,1967-01-01,3.1995
01/02/1967,1967-02-01,2.86783
01/03/1967,1967-03-01,2.54817
01/04/1967,1967-04-01,2.54027
01/05/1967,1967-05-01,2.31839
01/06/1967,1967-06-01,2.84126
01/07/1967,1967-07-01,2.92758
01/08/1967,1967-08-01,2.60337
01/09/1967,1967-09-01,2.59542
01/10/1967,1967-10-01,2.58752
01/11/1967,1967-11-01,3.10219
01/12/1967,1967-12-01,3.28068
01/01/1968,1968-01-01,3.64742
01/02/1968,1968-02-01,3.63636
01/03/1968,1968-03-01,3.93939
01/04/1968,1968-04-01,3.92749
01/05/1968,1968-05-01,4.22961
01/06/1968,1968-06-01,4.2042
01/07/1968,1968-07-01,4.49102
01/08/1968,1968-08-01,4.47761
01/09/1968,1968-09-01,4.46429
01/10/1968,1968-10-01,4.74777
01/11/1968,1968-11-01,4.42478
01/12/1968,1968-12-01,4.70588
01/01/1969,1969-01-01,4.69208
01/02/1969,1969-02-01,4.67836
01/03/1969,1969-03-01,5.24781
01/04/1969,1969-04-01,5.52326
01/05/1969,1969-05-01,5.50725
01/06/1969,1969-06-01,5.4755
01/07/1969,1969-07-01,5.44413
01/08/1969,1969-08-01,5.42857
01/09/1969,1969-09-01,5.69801
01/10/1969,1969-10-01,5.66572
01/11/1969,1969-11-01,5.9322
01/12/1969,1969-12-01,5.89888
01/01/1970,1970-01-01,6.16246
01/02/1970,1970-02-01,6.42458
01/03/1970,1970-03-01,6.09418
01/04/1970,1970-04-01,6.06061
01/05/1970,1970-05-01,6.04396
01/06/1970,1970-06-01,6.01093
01/07/1970,1970-07-01,5.70652
01/08/1970,1970-08-01,5.69106
01/09/1970,1970-09-01,5.66038
01/10/1970,1970-10-01,5.63003
01/11/1970,1970-11-01,5.6
01/12/1970,1970-12-01,5.57029
01/01/1971,1971-01-01,5.27704
01/02/1971,1971-02-01,4.72441
01/03/1971,1971-03-01,4.43864
01/04/1971,1971-04-01,4.15584
01/05/1971,1971-05-01,4.40415
01/06/1971,1971-06-01,4.38144
01/07/1971,1971-07-01,4.37018
01/08/1971,1971-08-01,4.35897
01/09/1971,1971-09-01,4.08163
01/10/1971,1971-10-01,3.80711
01/11/1971,1971-11-01,3.53535
01/12/1971,1971-12-01,3.26633
01/01/1972,1972-01-01,3.25815
01/02/1972,1972-02-01,3.7594
01/03/1972,1972-03-01,3.5
01/04/1972,1972-04-01,3.49127
01/05/1972,1972-05-01,3.22581
01/06/1972,1972-06-01,2.96296
01/07/1972,1972-07-01,2.95567
01/08/1972,1972-08-01,2.9484
01/09/1972,1972-09-01,3.18627
01/10/1972,1972-10-01,3.17848
01/11/1972,1972-11-01,3.41463
01/12/1972,1972-12-01,3.40633
01/01/1973,1973-01-01,3.64078
01/02/1973,1973-02-01,3.86473
01/03/1973,1973-03-01,4.83092
01/04/1973,1973-04-01,5.3012
01/05/1973,1973-05-01,5.52885
01/06/1973,1973-06-01,5.9952
01/07/1973,1973-07-01,5.74163
01/08/1973,1973-08-01,7.39857
01/09/1973,1973-09-01,7.36342
01/10/1973,1973-10-01,8.05687
01/11/1973,1973-11-01,8.25472
01/12/1973,1973-12-01,8.94118
01/01/1974,1974-01-01,9.60187
01/02/1974,1974-02-01,10.0
01/03/1974,1974-03-01,10.13825
01/04/1974,1974-04-01,10.06865
01/05/1974,1974-05-01,10.70615
01/06/1974,1974-06-01,10.85973
01/07/1974,1974-07-01,11.53846
01/08/1974,1974-08-01,10.88889
01/09/1974,1974-09-01,11.9469
01/10/1974,1974-10-01,11.84211
01/11/1974,1974-11-01,12.20044
01/12/1974,1974-12-01,12.09503
01/01/1975,1975-01-01,11.75214
01/02/1975,1975-02-01,11.20507
01/03/1975,1975-03-01,10.46025
01/04/1975,1975-04-01,10.18711
01/05/1975,1975-05-01,9.25926
01/06/1975,1975-06-01,9.18367
01/07/1975,1975-07-01,9.53347
01/08/1975,1975-08-01,8.61723
01/09/1975,1975-09-01,7.90514
01/10/1975,1975-10-01,7.64706
01/11/1975,1975-11-01,7.37864
01/12/1975,1975-12-01,7.12909
01/01/1976,1976-01-01,6.69216
01/02/1976,1976-02-01,6.27376
01/03/1976,1976-03-01,6.06061
01/04/1976,1976-04-01,5.84906
01/05/1976,1976-05-01,6.21469
01/06/1976,1976-06-01,5.98131
01/07/1976,1976-07-01,5.55556
01/08/1976,1976-08-01,5.71956
01/09/1976,1976-09-01,5.49451
01/10/1976,1976-10-01,5.46448
01/11/1976,1976-11-01,5.06329
01/12/1976,1976-12-01,5.03597
01/01/1977,1977-01-01,5.19713
01/02/1977,1977-02-01,6.08229
01/03/1977,1977-03-01,6.42857
01/04/1977,1977-04-01,6.95187
01/05/1977,1977-05-01,6.73759
01/06/1977,1977-06-01,6.70194
01/07/1977,1977-07-01,6.66667
01/08/1977,1977-08-01,6.63176
01/09/1977,1977-09-01,6.42361
01/10/1977,1977-10-01,6.39033
01/11/1977,1977-11-01,6.71256
01/12/1977,1977-12-01,6.67808
01/01/1978,1978-01-01,6.81431
01/02/1978,1978-02-01,6.23946
01/03/1978,1978-03-01,6.37584
01/04/1978,1978-04-01,6.5
01/05/1978,1978-05-01,7.14286
01/06/1978,1978-06-01,7.43802
01/07/1978,1978-07-01,7.73026
01/08/1978,1978-08-01,7.85597
01/09/1978,1978-09-01,8.48287
01/10/1978,1978-10-01,8.92857
01/11/1978,1978-11-01,8.87097
01/12/1978,1978-12-01,8.98876
01/01/1979,1979-01-01,9.2504
01/02/1979,1979-02-01,9.84127
01/03/1979,1979-03-01,10.25237
01/04/1979,1979-04-01,10.48513
01/05/1979,1979-05-01,10.69767
01/06/1979,1979-06-01,11.07692
01/07/1979,1979-07-01,11.45038
01/08/1979,1979-08-01,11.83612
01/09/1979,1979-09-01,11.8797
01/10/1979,1979-10-01,12.07154
01/11/1979,1979-11-01,12.59259
01/12/1979,1979-12-01,13.25479
01/01/1980,1980-01-01,13.86861
01/02/1980,1980-02-01,14.16185
01/03/1980,1980-03-01,14.59227
01/04/1980,1980-04-01,14.58924
01/05/1980,1980-05-01,14.42577
01/06/1980,1980-06-01,14.26593
01/07/1980,1980-07-01,13.15068
01/08/1980,1980-08-01,12.89009
01/09/1980,1980-09-01,12.76882
01/10/1980,1980-10-01,12.63298
01/11/1980,1980-11-01,12.63158
01/12/1980,1980-12-01,12.35371
01/01/1981,1981-01-01,11.79487
01/02/1981,1981-02-01,11.39241
01/03/1981,1981-03-01,10.61174
01/04/1981,1981-04-01,10.13597
01/05/1981,1981-05-01,9.79192
01/06/1981,1981-06-01,9.69697
01/07/1981,1981-07-01,10.77482
01/08/1981,1981-08-01,10.81731
01/09/1981,1981-09-01,10.96544
01/10/1981,1981-10-01,10.27155
01/11/1981,1981-11-01,9.57944
01/12/1981,1981-12-01,8.91204
01/01/1982,1982-01-01,8.25688
01/02/1982,1982-02-01,7.61364
01/03/1982,1982-03-01,6.88488
01/04/1982,1982-04-01,6.62177
01/05/1982,1982-05-01,6.91193
01/06/1982,1982-06-01,7.18232
01/07/1982,1982-07-01,6.55738
01/08/1982,1982-08-01,5.96529
01/09/1982,1982-09-01,4.94092
01/10/1982,1982-10-01,5.03212
01/11/1982,1982-11-01,4.47761
01/12/1982,1982-12-01,3.82572
01/01/1983,1983-01-01,3.70763
01/02/1983,1983-02-01,3.48469
01/03/1983,1983-03-01,3.59029
01/04/1983,1983-04-01,4.0
01/05/1983,1983-05-01,3.44108
01/06/1983,1983-06-01,2.47423
01/07/1983,1983-07-01,2.35897
01/08/1983,1983-08-01,2.4565
01/09/1983,1983-09-01,2.76356
01/10/1983,1983-10-01,2.75229
01/11/1983,1983-11-01,3.16327
01/12/1983,1983-12-01,3.7871
01/01/1984,1984-01-01,4.29009
01/02/1984,1984-02-01,4.69388
01/03/1984,1984-03-01,4.89297
01/04/1984,1984-04-01,4.55466
01/05/1984,1984-05-01,4.33468
01/06/1984,1984-06-01,4.32596
01/07/1984,1984-07-01,4.30862
01/08/1984,1984-08-01,4.2957
01/09/1984,1984-09-01,4.28287
01/10/1984,1984-10-01,4.26587
01/11/1984,1984-11-01,4.1543
01/12/1984,1984-12-01,4.04339
01/01/1985,1985-01-01,3.52595
01/02/1985,1985-02-01,3.60624
01/03/1985,1985-03-01,3.79009
01/04/1985,1985-04-01,3.5818
01/05/1985,1985-05-01,3.57488
01/06/1985,1985-06-01,3.66442
01/07/1985,1985-07-01,3.45821
01/08/1985,1985-08-01,3.35249
01/09/1985,1985-09-01,3.24737
01/10/1985,1985-10-01,3.23501
01/11/1985,1985-11-01,3.51377
01/12/1985,1985-12-01,3.79147
01/01/1986,1986-01-01,3.97351
01/02/1986,1986-02-01,3.19849
01/03/1986,1986-03-01,2.15356
01/04/1986,1986-04-01,1.58879
01/05/1986,1986-05-01,1.6791
01/06/1986,1986-06-01,1.76744
01/07/1986,1986-07-01,1.67131
01/08/1986,1986-08-01,1.57553
01/09/1986,1986-09-01,1.75763
01/10/1986,1986-10-01,1.56682
01/11/1986,1986-11-01,1.2844
01/12/1986,1986-12-01,1.18721
01/01/1987,1987-01-01,1.36488
01/02/1987,1987-02-01,1.91431
01/03/1987,1987-03-01,2.84143
01/04/1987,1987-04-01,3.67985
01/05/1987,1987-05-01,3.66972
01/06/1987,1987-06-01,3.74771
01/07/1987,1987-07-01,3.92694
01/08/1987,1987-08-01,4.28832
01/09/1987,1987-09-01,4.27273
01/10/1987,1987-10-01,4.35572
01/11/1987,1987-11-01,4.52899
01/12/1987,1987-12-01,4.33213
01/01/1988,1988-01-01,4.12926
01/02/1988,1988-02-01,3.9356
01/03/1988,1988-03-01,3.83244
01/04/1988,1988-04-01,3.9929
01/05/1988,1988-05-01,3.9823
01/06/1988,1988-06-01,3.96476
01/07/1988,1988-07-01,4.13005
01/08/1988,1988-08-01,4.11199
01/09/1988,1988-09-01,4.18483
01/10/1988,1988-10-01,4.26087
01/11/1988,1988-11-01,4.2461
01/12/1988,1988-12-01,4.41176
01/01/1989,1989-01-01,4.48276
01/02/1989,1989-02-01,4.64716
01/03/1989,1989-03-01,4.8927
01/04/1989,1989-04-01,5.03413
01/05/1989,1989-05-01,5.2766
01/06/1989,1989-06-01,5.16949
01/07/1989,1989-07-01,5.06329
01/08/1989,1989-08-01,4.62185
01/09/1989,1989-09-01,4.43515
01/10/1989,1989-10-01,4.58716
01/11/1989,1989-11-01,4.65503
01/12/1989,1989-12-01,4.6396
01/01/1990,1990-01-01,5.19802
01/02/1990,1990-02-01,5.26316
01/03/1990,1990-03-01,5.23732
01/04/1990,1990-04-01,4.71162
01/05/1990,1990-05-01,4.3654
01/06/1990,1990-06-01,4.67365
01/07/1990,1990-07-01,4.81928
01/08/1990,1990-08-01,5.70281
01/09/1990,1990-09-01,6.16987
01/10/1990,1990-10-01,6.37959
01/11/1990,1990-11-01,6.19539
01/12/1990,1990-12-01,6.25495
01/01/1991,1991-01-01,5.64706
01/02/1991,1991-02-01,5.3125
01/03/1991,1991-03-01,4.82115
01/04/1991,1991-04-01,4.80993
01/05/1991,1991-05-01,5.03486
01/06/1991,1991-06-01,4.69592
01/07/1991,1991-07-01,4.36782
01/08/1991,1991-08-01,3.79939
01/09/1991,1991-09-01,3.39623
01/10/1991,1991-10-01,2.84858
01/11/1991,1991-11-01,3.06657
01/12/1991,1991-12-01,2.98063
01/01/1992,1992-01-01,2.67261
01/02/1992,1992-02-01,2.81899
01/03/1992,1992-03-01,3.18991
01/04/1992,1992-04-01,3.18283
01/05/1992,1992-05-01,3.0236
01/06/1992,1992-06-01,3.01471
01/07/1992,1992-07-01,3.15712
01/08/1992,1992-08-01,3.07467
01/09/1992,1992-09-01,2.9927
01/10/1992,1992-10-01,3.27988
01/11/1992,1992-11-01,3.12046
01/12/1992,1992-12-01,2.96671
01/01/1993,1993-01-01,3.2538
01/02/1993,1993-02-01,3.24675
01/03/1993,1993-03-01,3.01941
01/04/1993,1993-04-01,3.15638
01/05/1993,1993-05-01,3.22119
01/06/1993,1993-06-01,2.99786
01/07/1993,1993-07-01,2.84698
01/08/1993,1993-08-01,2.84091
01/09/1993,1993-09-01,2.764
01/10/1993,1993-10-01,2.75229
01/11/1993,1993-11-01,2.74455
01/12/1993,1993-12-01,2.81096
01/01/1994,1994-01-01,2.45098
01/02/1994,1994-02-01,2.51572
01/03/1994,1994-03-01,2.65178
01/04/1994,1994-04-01,2.36439
01/05/1994,1994-05-01,2.28849
01/06/1994,1994-06-01,2.4948
01/07/1994,1994-07-01,2.69896
01/08/1994,1994-08-01,2.90055
01/09/1994,1994-09-01,2.96552
01/10/1994,1994-10-01,2.60989
01/11/1994,1994-11-01,2.60274
01/12/1994,1994-12-01,2.5974
01/01/1995,1995-01-01,2.87081
01/02/1995,1995-02-01,2.86299
01/03/1995,1995-03-01,2.78722
01/04/1995,1995-04-01,3.125
01/05/1995,1995-05-01,3.11864
01/06/1995,1995-06-01,3.0426
01/07/1995,1995-07-01,2.83019
01/08/1995,1995-08-01,2.61745
01/09/1995,1995-09-01,2.54521
01/10/1995,1995-10-01,2.74431
01/11/1995,1995-11-01,2.60347
01/12/1995,1995-12-01,2.53165
01/01/1996,1996-01-01,2.7907
01/02/1996,1996-02-01,2.71703
01/03/1996,1996-03-01,2.84392
01/04/1996,1996-04-01,2.83267
01/05/1996,1996-05-01,2.82709
01/06/1996,1996-06-01,2.82152
01/07/1996,1996-07-01,2.88336
01/08/1996,1996-08-01,2.8123
01/09/1996,1996-09-01,3.00457
01/10/1996,1996-10-01,3.06189
01/11/1996,1996-11-01,3.25309
01/12/1996,1996-12-01,3.37882
01/01/1997,1997-01-01,3.03814
01/02/1997,1997-02-01,3.03226
01/03/1997,1997-03-01,2.76527
01/04/1997,1997-04-01,2.43434
01/05/1997,1997-05-01,2.23785
01/06/1997,1997-06-01,2.23357
01/07/1997,1997-07-01,2.16561
01/08/1997,1997-08-01,2.29008
01/09/1997,1997-09-01,2.2194
01/10/1997,1997-10-01,2.08597
01/11/1997,1997-11-01,1.89036
01/12/1997,1997-12-01,1.69705
01/01/1998,1998-01-01,1.63112
01/02/1998,1998-02-01,1.4402
01/03/1998,1998-03-01,1.37672
01/04/1998,1998-04-01,1.4384
01/05/1998,1998-05-01,1.68856
01/06/1998,1998-06-01,1.62297
01/07/1998,1998-07-01,1.74564
01/08/1998,1998-08-01,1.61692
01/09/1998,1998-09-01,1.4268
01/10/1998,1998-10-01,1.48607
01/11/1998,1998-11-01,1.48423
01/12/1998,1998-12-01,1.60692
01/01/1999,1999-01-01,1.66667
01/02/1999,1999-02-01,1.66667
01/03/1999,1999-03-01,1.7284
01/04/1999,1999-04-01,2.28113
01/05/1999,1999-05-01,2.09102
01/06/1999,1999-06-01,1.9656
01/07/1999,1999-07-01,2.14461
01/08/1999,1999-08-01,2.26438
01/09/1999,1999-09-01,2.62997
01/10/1999,1999-10-01,2.56254
01/11/1999,1999-11-01,2.62035
01/12/1999,1999-12-01,2.6764
01/01/2000,2000-01-01,2.79296
01/02/2000,2000-02-01,3.21797
01/03/2000,2000-03-01,3.76214
01/04/2000,2000-04-01,3.01386
01/05/2000,2000-05-01,3.13253
01/06/2000,2000-06-01,3.73494
01/07/2000,2000-07-01,3.59928
01/08/2000,2000-08-01,3.35129
01/09/2000,2000-09-01,3.4565
01/10/2000,2000-10-01,3.45033
01/11/2000,2000-11-01,3.44418
01/12/2000,2000-12-01,3.43602
01/01/2001,2001-01-01,3.7212
01/02/2001,2001-02-01,3.52941
01/03/2001,2001-03-01,2.98246
01/04/2001,2001-04-01,3.21826
01/05/2001,2001-05-01,3.56308
01/06/2001,2001-06-01,3.19396
01/07/2001,2001-07-01,2.72148
01/08/2001,2001-08-01,2.72148
01/09/2001,2001-09-01,2.59217
01/10/2001,2001-10-01,2.12766
01/11/2001,2001-11-01,1.89437
01/12/2001,2001-12-01,1.60367
01/01/2002,2002-01-01,1.1959
01/02/2002,2002-02-01,1.13636
01/03/2002,2002-03-01,1.36286
01/04/2002,2002-04-01,1.64399
01/05/2002,2002-05-01,1.24083
01/06/2002,2002-06-01,1.06922
01/07/2002,2002-07-01,1.46561
01/08/2002,2002-08-01,1.74746
01/09/2002,2002-09-01,1.516
01/10/2002,2002-10-01,2.02703
01/11/2002,2002-11-01,2.25352
01/12/2002,2002-12-01,2.48027
01/01/2003,2003-01-01,2.75746
01/02/2003,2003-02-01,3.14607
01/03/2003,2003-03-01,3.02521
01/04/2003,2003-04-01,2.17513
01/05/2003,2003-05-01,1.89415
01/06/2003,2003-06-01,1.94878
01/07/2003,2003-07-01,2.05556
01/08/2003,2003-08-01,2.21607
01/09/2003,2003-09-01,2.37832
01/10/2003,2003-10-01,2.04194
01/11/2003,2003-11-01,1.92837
01/12/2003,2003-12-01,2.0352
01/01/2004,2004-01-01,2.02629
01/02/2004,2004-02-01,1.68845
01/03/2004,2004-03-01,1.74008
01/04/2004,2004-04-01,2.29258
01/05/2004,2004-05-01,2.89776
01/06/2004,2004-06-01,3.16767
01/07/2004,2004-07-01,2.93958
01/08/2004,2004-08-01,2.54743
01/09/2004,2004-09-01,2.53917
01/10/2004,2004-10-01,3.19091
01/11/2004,2004-11-01,3.62162
01/12/2004,2004-12-01,3.34232
01/01/2005,2005-01-01,2.84487
01/02/2005,2005-02-01,3.05303
01/03/2005,2005-03-01,3.20684
01/04/2005,2005-04-01,3.36179
01/05/2005,2005-05-01,2.86929
01/06/2005,2005-06-01,2.54103
01/07/2005,2005-07-01,3.06716
01/08/2005,2005-08-01,3.64693
01/09/2005,2005-09-01,4.74183
01/10/2005,2005-10-01,4.3501
01/11/2005,2005-11-01,3.33855
01/12/2005,2005-12-01,3.33855
01/01/2006,2006-01-01,4.01879
01/02/2006,2006-02-01,3.63825
01/03/2006,2006-03-01,3.41792
01/04/2006,2006-04-01,3.61384
01/05/2006,2006-05-01,3.97727
01/06/2006,2006-06-01,4.18172
01/07/2006,2006-07-01,4.10467
01/08/2006,2006-08-01,3.92657
01/09/2006,2006-09-01,2.01207
01/10/2006,2006-10-01,1.40633
01/11/2006,2006-11-01,1.9687
01/12/2006,2006-12-01,2.52398
01/01/2007,2007-01-01,2.07577
01/02/2007,2007-02-01,2.42026
01/03/2007,2007-03-01,2.7982
01/04/2007,2007-04-01,2.59292
01/05/2007,2007-05-01,2.70989
01/06/2007,2007-06-01,2.69277
01/07/2007,2007-07-01,2.31789
01/08/2007,2007-08-01,1.89745
01/09/2007,2007-09-01,2.83383
01/10/2007,2007-10-01,3.6107
01/11/2007,2007-11-01,4.37327
01/12/2007,2007-12-01,4.10881
01/01/2008,2008-01-01,4.2947
01/02/2008,2008-02-01,4.14296
01/03/2008,2008-03-01,3.9749
01/04/2008,2008-04-01,3.90376
01/05/2008,2008-05-01,4.08841
01/06/2008,2008-06-01,4.93597
01/07/2008,2008-07-01,5.49751
01/08/2008,2008-08-01,5.30802
01/09/2008,2008-09-01,4.95332
01/10/2008,2008-10-01,3.73106
01/11/2008,2008-11-01,1.09992
01/12/2008,2008-12-01,-0.02223
01/01/2009,2009-01-01,-0.11359
01/02/2009,2009-02-01,0.00846
01/03/2009,2009-03-01,-0.44648
01/04/2009,2009-04-01,-0.57632
01/05/2009,2009-05-01,-1.01576
01/06/2009,2009-06-01,-1.22917
01/07/2009,2009-07-01,-1.95876
01/08/2009,2009-08-01,-1.48384
01/09/2009,2009-09-01,-1.37794
01/10/2009,2009-10-01,-0.22397
01/11/2009,2009-11-01,1.91459
01/12/2009,2009-12-01,2.81412
01/01/2010,2010-01-01,2.62111
01/02/2010,2010-02-01,2.15134
01/03/2010,2010-03-01,2.28617
01/04/2010,2010-04-01,2.20677
01/05/2010,2010-05-01,2.00355
01/06/2010,2010-06-01,1.12156
01/07/2010,2010-07-01,1.34078
01/08/2010,2010-08-01,1.15018
01/09/2010,2010-09-01,1.11831
01/10/2010,2010-10-01,1.1667
01/11/2010,2010-11-01,1.08454
01/12/2010,2010-12-01,1.43779
01/01/2011,2011-01-01,1.70078
01/02/2011,2011-02-01,2.1249
01/03/2011,2011-03-01,2.61924
01/04/2011,2011-04-01,3.07723
01/05/2011,2011-05-01,3.45897
01/06/2011,2011-06-01,3.50232
01/07/2011,2011-07-01,3.57988
01/08/2011,2011-08-01,3.755
01/09/2011,2011-09-01,3.81262
01/10/2011,2011-10-01,3.52227
01/11/2011,2011-11-01,3.45143
01/12/2011,2011-12-01,3.06207
01/01/2012,2012-01-01,3.00877
01/02/2012,2012-02-01,2.89818
01/03/2012,2012-03-01,2.58288
01/04/2012,2012-04-01,2.27316
01/05/2012,2012-05-01,1.73794
01/06/2012,2012-06-01,1.65387
01/07/2012,2012-07-01,1.41751
01/08/2012,2012-08-01,1.68593
01/09/2012,2012-09-01,1.94972
01/10/2012,2012-10-01,2.15568
01/11/2012,2012-11-01,1.79602
01/12/2012,2012-12-01,1.7595
01/01/2013,2013-01-01,1.68406
01/02/2013,2013-02-01,2.01814
01/03/2013,2013-03-01,1.51875
01/04/2013,2013-04-01,1.13881
01/05/2013,2013-05-01,1.39039
01/06/2013,2013-06-01,1.71579
01/07/2013,2013-07-01,1.88547
01/08/2013,2013-08-01,1.53881
01/09/2013,2013-09-01,1.09473
01/10/2013,2013-10-01,0.8768
01/11/2013,2013-11-01,1.23287
01/12/2013,2013-12-01,1.51284
01/01/2014,2014-01-01,1.55776
01/02/2014,2014-02-01,1.12047
01/03/2014,2014-03-01,1.61269
01/04/2014,2014-04-01,2.01513
01/05/2014,2014-05-01,2.16695
01/06/2014,2014-06-01,2.05898
01/07/2014,2014-07-01,1.97424
01/08/2014,2014-08-01,1.7151
01/09/2014,2014-09-01,1.68405
01/10/2014,2014-10-01,1.60954
01/11/2014,2014-11-01,1.23152
01/12/2014,2014-12-01,0.65312
01/01/2015,2015-01-01,-0.22993
01/02/2015,2015-02-01,-0.08703
01/03/2015,2015-03-01,-0.02203
01/04/2015,2015-04-01,-0.10403
01/05/2015,2015-05-01,0.03503
01/06/2015,2015-06-01,0.17957
01/07/2015,2015-07-01,0.22569
01/08/2015,2015-08-01,0.2413
01/09/2015,2015-09-01,0.00884
01/10/2015,2015-10-01,0.12762
01/11/2015,2015-11-01,0.43632
01/12/2015,2015-12-01,0.63872
01/01/2016,2016-01-01,1.2375
01/02/2016,2016-02-01,0.84728
01/03/2016,2016-03-01,0.89162
01/04/2016,2016-04-01,1.17263
01/05/2016,2016-05-01,1.07848
01/06/2016,2016-06-01,1.07929
01/07/2016,2016-07-01,0.86836
01/08/2016,2016-08-01,1.05532
01/09/2016,2016-09-01,1.54864
01/10/2016,2016-10-01,1.68592
01/11/2016,2016-11-01,1.68433
01/12/2016,2016-12-01,2.0508
01/01/2017,2017-01-01,2.51039
01/02/2017,2017-02-01,2.81036
01/03/2017,2017-03-01,2.4412
01/04/2017,2017-04-01,2.17622
01/05/2017,2017-05-01,1.85634
01/06/2017,2017-06-01,1.64057
01/07/2017,2017-07-01,1.72511
01/08/2017,2017-08-01,1.92812
01/09/2017,2017-09-01,2.18057
01/10/2017,2017-10-01,2.02076
01/11/2017,2017-11-01,2.17249
01/12/2017,2017-12-01,2.12993
01/01/2018,2018-01-01,2.1037
01/02/2018,2018-02-01,2.22658
01/03/2018,2018-03-01,2.33259
01/04/2018,2018-04-01,2.43783
01/05/2018,2018-05-01,2.77659
01/06/2018,2018-06-01,2.84851
01/07/2018,2018-07-01,2.89875
01/08/2018,2018-08-01,2.678
01/09/2018,2018-09-01,2.35518
01/10/2018,2018-10-01,2.52852
01/11/2018,2018-11-01,2.17281
01/12/2018,2018-12-01,1.91522
01/01/2019,2019-01-01,1.49833
01/02/2019,2019-02-01,1.48172
01/03/2019,2019-03-01,1.87995
01/04/2019,2019-04-01,2.00563
01/05/2019,2019-05-01,1.81275
01/06/2019,2019-06-01,1.68964
01/07/2019,2019-07-01,1.82116
01/08/2019,2019-08-01,1.75969
01/09/2019,2019-09-01,1.72733
01/10/2019,2019-10-01,1.75708
01/11/2019,2019-11-01,2.03082
01/12/2019,2019-12-01,2.26172
01/01/2020,2020-01-01,2.46049
01/02/2020,2020-02-01,2.31971
01/03/2020,2020-03-01,1.53064
01/04/2020,2020-04-01,0.36486
01/05/2020,2020-05-01,0.24244
01/06/2020,2020-06-01,0.72681
01/07/2020,2020-07-01,1.03283
01/08/2020,2020-08-01,1.32759
01/09/2020,2020-09-01,1.40065
01/10/2020,2020-10-01,1.1842
01/11/2020,2020-11-01,1.13776
01/12/2020,2020-12-01,1.27815
01/01/2021,2021-01-01,1.35997
01/02/2021,2021-02-01,1.67524
01/03/2021,2021-03-01,2.65838
01/04/2021,2021-04-01,4.15199
01/05/2021,2021-05-01,4.94444
01/06/2021,2021-06-01,5.34102
01/07/2021,2021-07-01,5.2761
01/08/2021,2021-08-01,5.20533
01/09/2021,2021-09-01,5.38991
01/10/2021,2021-10-01,6.23694
01/11/2021,2021-11-01,6.82837
01/12/2021,2021-12-01,7.09654
01/01/2022,2022-01-01,7.52593
